{
  "schema_version": 1,
  "invariant_id": "HELIX_NO_HARDLINKS_V1",
  "version": "1.0.0",
  "authority": "LOUIS_OPERATOR_DIRECTIVE",
  "custodian": "repo-cp",
  "scope": "HELIX_ARPA_CONTROL_PLANE_ARTIFACTS",
  "prohibited_uses": [
    "protected_files",
    "credential_material",
    "ceremony_ledgers",
    "intent_records",
    "receipts",
    "recovery_state",
    "backups",
    "evidence_staging",
    "publication_staging",
    "cross_checkout_artifact_reuse",
    "repository_migration",
    "repository_synchronization",
    "snapshot_construction",
    "normal_test_fixtures",
    "all_control_plane_file_copy_preserve_publish_restore_operations"
  ],
  "protected_regular_file_nlink": 1,
  "only_exception": {
    "purpose": "BOUNDED_NEGATIVE_REJECTION_TEST",
    "must_remain_in_test_directory": true,
    "normal_fixture_setup": false
  },
  "out_of_scope": [
    "operating_system_internals",
    "package_manager_internals",
    "git_internals",
    "unrelated_application_artifacts"
  ],
  "audit": {
    "excluded_components": [
      ".git",
      ".agent-checkouts",
      ".venv",
      "venv",
      "virtualenv",
      "node_modules",
      "site-packages",
      "__pycache__",
      ".cache",
      ".pytest_cache",
      ".mypy_cache",
      ".ruff_cache",
      ".tox",
      ".nox",
      "dependency-tree",
      "mnt",
      "media",
      "proc",
      "sys",
      "dev",
      "run"
    ],
    "exclude_mounts": true,
    "follow_symlinks": false,
    "read_file_contents": false,
    "peer_selection": "EXISTING_ENROLLMENT_PUBLIC_ALLOWLIST",
    "repository_excluded_paths": [],
    "protected_prefixes": [
      "pins",
      "registries",
      "docs/acceptance"
    ],
    "protected_hardlink_status": "BLOCKED",
    "workflow_hardlink_status": "DRIFT",
    "unavailable_status": "UNKNOWN",
    "symlink_status": "BLOCKED",
    "single_link_status": "PASS"
  },
  "replacement": [
    "OPEN_SOURCE_NOFOLLOW",
    "REQUIRE_REGULAR_NLINK_ONE",
    "CREATE_EXCLUSIVE_TEMP_ON_DESTINATION_FILESYSTEM",
    "COPY_BYTES_WITHOUT_ARGUMENT_OR_LOG_EXPOSURE",
    "APPLY_EXPLICIT_OWNERSHIP_AND_MODE",
    "VERIFY_BYTE_COUNT_AND_SHA256_FROM_OPEN_DESCRIPTORS",
    "FSYNC_DESTINATION_FILE",
    "ATOMIC_RENAME_ON_DESTINATION_FILESYSTEM",
    "FSYNC_CONTAINING_DIRECTORY",
    "VERIFY_PUBLISHED_REGULAR_OWNERSHIP_MODE_HASH_NLINK_ONE"
  ],
  "remediation": {
    "automatic": false,
    "existing_violation_mutation": false,
    "requires": [
      "EXPLICIT_AUTHORIZATION",
      "BACKUP",
      "ROLLBACK",
      "EVIDENCE"
    ]
  },
  "automatic_execution": false,
  "production_engineering": {
    "applies_to": [
      "PRIVILEGED",
      "SECURITY_SENSITIVE",
      "STATE_CHANGING",
      "PUBLICATION"
    ],
    "ordinary_utilities": "EXISTING_REPOSITORY_RISK_AND_AUTHORITY_RULES",
    "requirements": {
      "Privilege and execution integrity": [
        "Never execute ignored, generated, untracked, dirty or user-substitutable source with elevated privileges.",
        "Bind privileged execution to an exact reviewed revision, tracked file set, expected repository identity, clean relevant scope and verified ownership.",
        "Verify before execution through a trusted launcher or previously installed root-owned entry point; a running program cannot establish trust in its own source.",
        "Never add global Git safe.directory exceptions; any exception must be command-scoped, exact-path, ownership-checked and end with the command.",
        "Separate public inspection, preparation, authorization and mutation operations.",
        "Read-only commands must not write caches, bytecode, lock files or metadata, or change atime through sensitive copies.",
        "Use least privilege; never grant unrestricted shells, blanket sudo, Docker group/socket access or broader filesystem access for a narrow operation.",
        "Privileged helpers must expose a fixed documented interface and reject unknown operations or arguments."
      ],
      "Filesystem and path safety": [
        "Use absolute paths for protected operations; reject empty, relative, ambiguous, traversal-containing or unexpectedly resolved paths.",
        "Never follow symlinks for protected sources or destinations; use descriptor-relative operations, O_NOFOLLOW and exclusive creation where available.",
        "Validate opened descriptors with fstat; require expected type, owner, group, mode, device and link count, not only a pathname precheck.",
        "Fail on changes to inode, device, ownership, size, link count or policy-relevant metadata during an operation.",
        "Create unpredictable temporary names with secure platform randomness in the destination directory/filesystem, with restrictive permissions at creation.",
        "Never assume /tmp permits atomic target publication; never use shell globs for protected mutation targets.",
        "Never recursively mutate before independently validating the exact resolved boundary."
      ],
      "Durable state and transactions": [
        "Define preconditions, intended mutation, commit point, success evidence, rollback boundary and crash recovery for every state change.",
        "Never claim atomicity across systems without a shared transaction mechanism.",
        "Database-plus-filesystem protocols must durably distinguish mutation not started, prepared, primary committed, receipt pending, completed, rollback required and operator adjudication.",
        "Persist and fsync intent before the irreversible boundary; make completion and recovery idempotent.",
        "Report explicit indeterminate/recovery-required state when primary commit may have happened; never report an ordinary failed mutation then.",
        "Every retry must inspect current state and decide safely whether to resume, finalize, roll back or stop; provide a governed stale-operation resolver.",
        "Use resource-appropriate locking; detect concurrent writers and fail closed; timestamps alone are not identities or concurrency controls.",
        "Preserve previous valid state until replacement is verified and durably published.",
        "Version migrations, identify one-way effects, repeat safely where possible and test rollback or forward recovery."
      ],
      "Signals, cancellation and cleanup": [
        "Handle SIGINT, SIGHUP and SIGTERM where supported; record value-free controlled interruption and release locks.",
        "Assume SIGKILL, power loss, kernel and storage failure; recovery cannot rely exclusively on handlers.",
        "Cleanup must preserve the original failure and never falsely claim rollback success.",
        "Remove temporary artifacts only after revalidating identity and ownership; never delete the last known-good copy in generic cleanup."
      ],
      "Input and credential handling": [
        "Validate structural and policy requirements before durable mutation wherever possible.",
        "Treat account identifiers as application-defined opaque values unless a schema proves stronger semantics; reject controls and unsafe encodings, and do not infer email semantics.",
        "Never put credentials, recovery material or private keys in argv, environment, process listings, URLs, receipts, exceptions, tests or logs.",
        "Obtain secrets only through an approved trusted prompt or protected descriptor; keep secret/account prompts on the trusted terminal, not stdout.",
        "Clearly label hidden prompts and announce length/format rules first; bound retries for correctable input mistakes.",
        "Distinguish cancellation, authentication failure, policy rejection, integrity failure, concurrency conflict and internal failure without exposing values.",
        "Use established cryptographically secure randomness and library cryptography; never invent cryptographic algorithms or password-hashing formats.",
        "Use constant-time library comparison for authentication-sensitive fixed-length values where applicable.",
        "Never use unrestricted pickle or unsafe YAML deserialization; parameterize database operations rather than interpolating credential input."
      ],
      "Subprocess and shell safety": [
        "Prefer libraries; pass argument arrays, never interpolated shell strings or shell=True for protected operations.",
        "Privileged subprocesses require absolute executables, verified executable identity/package provenance, a minimal controlled environment and known working directory.",
        "Set explicit timeouts and bounded output, check return codes, and retain stderr only for redacted private diagnosis.",
        "Use stable machine-readable interfaces rather than human-output parsing; bound retries to proven repeatable operations."
      ],
      "Error and status integrity": [
        "Fail closed on unknown authority, schema, ownership, provenance or state; preserve materially distinct outcomes.",
        "Public errors may be concise; durable private records require value-free categorical causes.",
        "Public receipts must never contain credentials, usable credential hashes, prompt contents or private paths.",
        "Broad exceptions must re-raise or map to explicit safe states; never use language assertions for security enforcement.",
        "Success requires independent postcondition verification, not command exit zero alone.",
        "STARTED, FAILED, INTERRUPTED, RECOVERY_REQUIRED and COMPLETED have distinct meanings; absent evidence remains UNKNOWN."
      ],
      "Determinism and reproducibility": [
        "Use stable schemas, ordering, encodings and value types; durable timestamps must be UTC with explicit timezone.",
        "Inject clocks, randomness, host identity and filesystem boundaries in tests; do not depend on ambient live state.",
        "Normalize only proven semantic equivalences and document every accepted normalization.",
        "Bind receipts/transitions to content, policy identity and relevant state, not Git ancestry alone.",